{
  "$schema": "https://json-schema.org/draft/2020-12/schema",
  "$id": "https://contracts.rep02.invalid/v1/report-model.schema.json",
  "title": "REP-02 Public Report Model",
  "description": "Closed public schema for the deterministic WF-02-06 report model. Its normalized report findings are not D1 finding entities and must not be coerced into that entity contract.",
  "$comment": "D1 finding entities require subject_ref and limit_context. Report-model findings instead bind a component result through finding_kind, technical_locator, and technical_result_hash.",
  "type": "object",
  "additionalProperties": false,
  "required": [
    "schema_version",
    "reporter_version",
    "package_version",
    "status",
    "status_counts",
    "component_results",
    "findings",
    "adapter_limitations",
    "limitations",
    "hash_policy",
    "report_model_hash"
  ],
  "properties": {
    "schema_version": {"const": "1.0.0"},
    "reporter_version": {"const": "0.1.0"},
    "package_version": {"$ref": "#/$defs/version"},
    "generated_at": {"$ref": "#/$defs/timestamp"},
    "status": {"$ref": "#/$defs/status"},
    "status_counts": {
      "type": "object",
      "additionalProperties": false,
      "required": ["BLOCKED", "FAIL", "UNKNOWN", "NOT_RUN", "PASS"],
      "properties": {
        "BLOCKED": {"$ref": "#/$defs/count"},
        "FAIL": {"$ref": "#/$defs/count"},
        "UNKNOWN": {"$ref": "#/$defs/count"},
        "NOT_RUN": {"$ref": "#/$defs/count"},
        "PASS": {"$ref": "#/$defs/count"}
      }
    },
    "component_results": {
      "type": "array",
      "minItems": 1,
      "uniqueItems": true,
      "items": {"$ref": "#/$defs/componentResult"}
    },
    "findings": {
      "type": "array",
      "minItems": 1,
      "uniqueItems": true,
      "items": {"$ref": "#/$defs/reportFinding"}
    },
    "adapter_limitations": {
      "type": "array",
      "minItems": 1,
      "uniqueItems": true,
      "items": {"$ref": "#/$defs/adapterLimitation"}
    },
    "limitations": {
      "type": "array",
      "minItems": 1,
      "uniqueItems": true,
      "items": {"$ref": "#/$defs/nonEmptyString"}
    },
    "hash_policy": {"$ref": "#/$defs/hashPolicy"},
    "report_model_hash": {"$ref": "#/$defs/sha256"}
  },
  "$defs": {
    "adapterLimitation": {
      "type": "object",
      "additionalProperties": false,
      "required": ["adapter_id", "status", "reason_code", "message"],
      "properties": {
        "adapter_id": {"$ref": "#/$defs/id"},
        "status": {"enum": ["NOT_RUN", "BLOCKED"]},
        "reason_code": {"$ref": "#/$defs/id"},
        "message": {"$ref": "#/$defs/nonEmptyString"}
      }
    },
    "componentResult": {
      "type": "object",
      "additionalProperties": false,
      "required": [
        "component_id",
        "rule_id",
        "status",
        "input_hash",
        "tool_name",
        "tool_version",
        "package_version",
        "technical_result_hash"
      ],
      "properties": {
        "component_id": {"$ref": "#/$defs/id"},
        "rule_id": {"$ref": "#/$defs/id"},
        "status": {"$ref": "#/$defs/status"},
        "input_hash": {"$ref": "#/$defs/sha256"},
        "tool_name": {"$ref": "#/$defs/id"},
        "tool_version": {"$ref": "#/$defs/version"},
        "package_version": {"$ref": "#/$defs/version"},
        "technical_result_hash": {"$ref": "#/$defs/sha256"}
      }
    },
    "count": {
      "type": "integer",
      "minimum": 0
    },
    "hashPolicy": {
      "type": "object",
      "additionalProperties": false,
      "required": [
        "algorithm",
        "canonicalization",
        "technical_result_scope",
        "report_model_scope"
      ],
      "properties": {
        "algorithm": {"const": "SHA-256"},
        "canonicalization": {"const": "REP02_SORTED_MINIFIED_UTF8_JSON"},
        "technical_result_scope": {"const": "EXACT_COMPONENT_RESULT_EXCLUDING_EXPLICIT_REPORT_GENERATED_AT"},
        "report_model_scope": {"const": "ALL_REPORT_MODEL_FIELDS_EXCEPT_GENERATED_AT_AND_REPORT_MODEL_HASH"}
      }
    },
    "id": {
      "type": "string",
      "minLength": 1,
      "pattern": "^[A-Za-z][A-Za-z0-9_.:-]*$"
    },
    "nonEmptyString": {
      "type": "string",
      "minLength": 1,
      "pattern": ".*\\S.*"
    },
    "reportFinding": {
      "type": "object",
      "additionalProperties": false,
      "required": [
        "finding_id",
        "finding_kind",
        "technical_locator",
        "rule_id",
        "status",
        "reason_code",
        "message",
        "source_refs",
        "input_hash",
        "tool_name",
        "tool_version",
        "package_version",
        "technical_result_hash"
      ],
      "properties": {
        "finding_id": {"$ref": "#/$defs/id"},
        "finding_kind": {"enum": ["COMPONENT_RESULT", "COMPONENT_ISSUE"]},
        "technical_locator": {"$ref": "#/$defs/nonEmptyString"},
        "rule_id": {"$ref": "#/$defs/id"},
        "status": {"$ref": "#/$defs/status"},
        "reason_code": {"$ref": "#/$defs/id"},
        "message": {"$ref": "#/$defs/nonEmptyString"},
        "source_refs": {
          "type": "array",
          "minItems": 1,
          "uniqueItems": true,
          "items": {"$ref": "#/$defs/sourceRef"}
        },
        "input_hash": {"$ref": "#/$defs/sha256"},
        "tool_name": {"$ref": "#/$defs/id"},
        "tool_version": {"$ref": "#/$defs/version"},
        "package_version": {"$ref": "#/$defs/version"},
        "technical_result_hash": {"$ref": "#/$defs/sha256"}
      }
    },
    "sha256": {
      "type": "string",
      "pattern": "^[0-9a-f]{64}$"
    },
    "sourceRef": {
      "type": "object",
      "additionalProperties": false,
      "required": ["source_id", "version", "sha256"],
      "properties": {
        "source_id": {"$ref": "#/$defs/id"},
        "version": {"$ref": "#/$defs/version"},
        "sha256": {"$ref": "#/$defs/sha256"}
      }
    },
    "status": {
      "enum": ["BLOCKED", "FAIL", "UNKNOWN", "NOT_RUN", "PASS"]
    },
    "timestamp": {
      "type": "string",
      "format": "date-time",
      "pattern": "^\\d{4}-\\d{2}-\\d{2}T\\d{2}:\\d{2}:\\d{2}(?:\\.\\d+)?(?:Z|[+-]\\d{2}:\\d{2})$"
    },
    "version": {
      "type": "string",
      "minLength": 1,
      "pattern": "^\\S(?:.*\\S)?$"
    }
  }
}
