{
  "adapter_limitations": [
    {
      "adapter_id": "REP-01",
      "message": "Live REP-01 integration was not executed in this reporting slice.",
      "reason_code": "LIVE_ADAPTER_NOT_IMPLEMENTED",
      "status": "NOT_RUN"
    },
    {
      "adapter_id": "REP-03",
      "message": "Live REP-03 integration was not executed in this reporting slice.",
      "reason_code": "LIVE_ADAPTER_NOT_IMPLEMENTED",
      "status": "NOT_RUN"
    }
  ],
  "component_results": [
    {
      "component_id": "REP02.INTEGRATION.FILE_API:76fc12e9c61bc049",
      "input_hash": "76fc12e9c61bc049ca202764ee5e99adbb0da1db8bfe198861360ececf28edbb",
      "package_version": "0.4.0",
      "rule_id": "REP02.INTEGRATION.FILE_API",
      "status": "NOT_RUN",
      "technical_result_hash": "e2c320613dd849196b6ceba15c5941a90c917b64fc9939d20836db91b0c24250",
      "tool_name": "power-rail-file-api-validator",
      "tool_version": "0.1.0"
    },
    {
      "component_id": "REP02.INTEGRATION.FILE_API:f738678d80ef5bb6",
      "input_hash": "f738678d80ef5bb6bd4a4c054e7429eccfee5fce44d594d685091d9f721b3b94",
      "package_version": "0.4.0",
      "rule_id": "REP02.INTEGRATION.FILE_API",
      "status": "PASS",
      "technical_result_hash": "eaa298aea628e5c8796d2aa0a4c5fbddb7f5647df4af61a156dd44d665cf04b8",
      "tool_name": "power-rail-file-api-validator",
      "tool_version": "0.1.0"
    },
    {
      "component_id": "REP02.REGULATOR.REVIEW:RR-SYNTHETIC-NOMINAL",
      "input_hash": "32142ff5413bdda872173b3900b230a5e4dfacbb364ad716f69922f702d74cb1",
      "package_version": "0.4.0",
      "rule_id": "REP02.REGULATOR.REVIEW",
      "status": "PASS",
      "technical_result_hash": "bc9ba465695d9257ee64587660a09a55ca856c9536f1fbef0b21e0117fbb3230",
      "tool_name": "power-rail-validation",
      "tool_version": "0.1.0"
    },
    {
      "component_id": "REP02.REGULATOR.REVIEW:RR-WORKSPACE-GAP-02",
      "input_hash": "1b8f7684a42f33b5e4a4e2f255d9a8849d34f9c32834eb47df50f483dccf29fe",
      "package_version": "0.4.0",
      "rule_id": "REP02.REGULATOR.REVIEW",
      "status": "BLOCKED",
      "technical_result_hash": "c6bdea93c3d7f26b07a16cc631f0d859c9139b4e1bb1a87c42bc472c0cabc900",
      "tool_name": "power-rail-validation",
      "tool_version": "0.1.0"
    }
  ],
  "findings": [
    {
      "finding_id": "RPT-343C5115C76C83FD5C0B9EFB",
      "finding_kind": "COMPONENT_RESULT",
      "input_hash": "f738678d80ef5bb6bd4a4c054e7429eccfee5fce44d594d685091d9f721b3b94",
      "message": "REP02.INTEGRATION.FILE_API returned PASS: FILE_API_DESCRIPTOR_VALID.",
      "package_version": "0.4.0",
      "reason_code": "FILE_API_DESCRIPTOR_VALID",
      "rule_id": "REP02.INTEGRATION.FILE_API",
      "source_refs": [
        {
          "sha256": "e1a40ffd49fb126152a89e37e173ca8aeb87c76f9dc6477540a4b0708c2857da",
          "source_id": "REP02-FILE-API-CONTRACT",
          "version": "1.0.0"
        }
      ],
      "status": "PASS",
      "technical_locator": "$",
      "technical_result_hash": "eaa298aea628e5c8796d2aa0a4c5fbddb7f5647df4af61a156dd44d665cf04b8",
      "tool_name": "power-rail-file-api-validator",
      "tool_version": "0.1.0"
    },
    {
      "finding_id": "RPT-6477AEFE010F895CECCE8B7B",
      "finding_kind": "COMPONENT_ISSUE",
      "input_hash": "76fc12e9c61bc049ca202764ee5e99adbb0da1db8bfe198861360ececf28edbb",
      "message": "external artifact is explicitly unavailable; no content hash was synthesized",
      "package_version": "0.4.0",
      "reason_code": "EXTERNAL_ARTIFACT_NOT_PROVIDED",
      "rule_id": "REP02.INTEGRATION.FILE_API",
      "source_refs": [
        {
          "sha256": "e1a40ffd49fb126152a89e37e173ca8aeb87c76f9dc6477540a4b0708c2857da",
          "source_id": "REP02-FILE-API-CONTRACT",
          "version": "1.0.0"
        }
      ],
      "status": "NOT_RUN",
      "technical_locator": "$.issues[0]",
      "technical_result_hash": "e2c320613dd849196b6ceba15c5941a90c917b64fc9939d20836db91b0c24250",
      "tool_name": "power-rail-file-api-validator",
      "tool_version": "0.1.0"
    },
    {
      "finding_id": "RPT-5E4242B226D314D28BDEAA2E",
      "finding_kind": "COMPONENT_RESULT",
      "input_hash": "76fc12e9c61bc049ca202764ee5e99adbb0da1db8bfe198861360ececf28edbb",
      "message": "REP02.INTEGRATION.FILE_API returned NOT_RUN: EXTERNAL_ARTIFACT_NOT_PROVIDED.",
      "package_version": "0.4.0",
      "reason_code": "EXTERNAL_ARTIFACT_NOT_PROVIDED",
      "rule_id": "REP02.INTEGRATION.FILE_API",
      "source_refs": [
        {
          "sha256": "e1a40ffd49fb126152a89e37e173ca8aeb87c76f9dc6477540a4b0708c2857da",
          "source_id": "REP02-FILE-API-CONTRACT",
          "version": "1.0.0"
        }
      ],
      "status": "NOT_RUN",
      "technical_locator": "$",
      "technical_result_hash": "e2c320613dd849196b6ceba15c5941a90c917b64fc9939d20836db91b0c24250",
      "tool_name": "power-rail-file-api-validator",
      "tool_version": "0.1.0"
    },
    {
      "finding_id": "RPT-11FF6B2BF3F2454DB577231F",
      "finding_kind": "COMPONENT_ISSUE",
      "input_hash": "76fc12e9c61bc049ca202764ee5e99adbb0da1db8bfe198861360ececf28edbb",
      "message": "external artifact is explicitly unavailable; no content hash was synthesized",
      "package_version": "0.4.0",
      "reason_code": "EXTERNAL_SOURCE_NOT_PROVIDED",
      "rule_id": "REP02.INTEGRATION.FILE_API",
      "source_refs": [
        {
          "sha256": "e1a40ffd49fb126152a89e37e173ca8aeb87c76f9dc6477540a4b0708c2857da",
          "source_id": "REP02-FILE-API-CONTRACT",
          "version": "1.0.0"
        }
      ],
      "status": "NOT_RUN",
      "technical_locator": "$.issues[1]",
      "technical_result_hash": "e2c320613dd849196b6ceba15c5941a90c917b64fc9939d20836db91b0c24250",
      "tool_name": "power-rail-file-api-validator",
      "tool_version": "0.1.0"
    },
    {
      "finding_id": "RPT-7BDABFCA03D0EF53EB922213",
      "finding_kind": "COMPONENT_ISSUE",
      "input_hash": "1b8f7684a42f33b5e4a4e2f255d9a8849d34f9c32834eb47df50f483dccf29fe",
      "message": "source 'SRC-RR-DATASHEET' is not AVAILABLE",
      "package_version": "0.4.0",
      "reason_code": "SOURCE_UNAVAILABLE",
      "rule_id": "REP02.REGULATOR.IOUT.ABSOLUTE_MAXIMUM",
      "source_refs": [
        {
          "sha256": "92ab4059050fb5d381fa4b7c7cbf2301212c6956be0255d39f8da15ccb85187b",
          "source_id": "REP02-RR-RULES",
          "version": "REP02-RR-RULESET-1.0.0"
        }
      ],
      "status": "BLOCKED",
      "technical_locator": "$.issues[0]",
      "technical_result_hash": "c6bdea93c3d7f26b07a16cc631f0d859c9139b4e1bb1a87c42bc472c0cabc900",
      "tool_name": "power-rail-validation",
      "tool_version": "0.1.0"
    },
    {
      "finding_id": "RPT-ACEC2ADB0196B79EC1C0F662",
      "finding_kind": "COMPONENT_ISSUE",
      "input_hash": "1b8f7684a42f33b5e4a4e2f255d9a8849d34f9c32834eb47df50f483dccf29fe",
      "message": "source 'SRC-RR-DATASHEET' is not AVAILABLE",
      "package_version": "0.4.0",
      "reason_code": "SOURCE_UNAVAILABLE",
      "rule_id": "REP02.REGULATOR.IOUT.DERATING",
      "source_refs": [
        {
          "sha256": "92ab4059050fb5d381fa4b7c7cbf2301212c6956be0255d39f8da15ccb85187b",
          "source_id": "REP02-RR-RULES",
          "version": "REP02-RR-RULESET-1.0.0"
        }
      ],
      "status": "BLOCKED",
      "technical_locator": "$.issues[1]",
      "technical_result_hash": "c6bdea93c3d7f26b07a16cc631f0d859c9139b4e1bb1a87c42bc472c0cabc900",
      "tool_name": "power-rail-validation",
      "tool_version": "0.1.0"
    },
    {
      "finding_id": "RPT-7E47FE65368AF2BA0E21E3F8",
      "finding_kind": "COMPONENT_ISSUE",
      "input_hash": "1b8f7684a42f33b5e4a4e2f255d9a8849d34f9c32834eb47df50f483dccf29fe",
      "message": "source 'SRC-RR-DATASHEET' is not AVAILABLE",
      "package_version": "0.4.0",
      "reason_code": "SOURCE_UNAVAILABLE",
      "rule_id": "REP02.REGULATOR.IOUT.RECOMMENDED_OPERATING",
      "source_refs": [
        {
          "sha256": "92ab4059050fb5d381fa4b7c7cbf2301212c6956be0255d39f8da15ccb85187b",
          "source_id": "REP02-RR-RULES",
          "version": "REP02-RR-RULESET-1.0.0"
        }
      ],
      "status": "BLOCKED",
      "technical_locator": "$.issues[2]",
      "technical_result_hash": "c6bdea93c3d7f26b07a16cc631f0d859c9139b4e1bb1a87c42bc472c0cabc900",
      "tool_name": "power-rail-validation",
      "tool_version": "0.1.0"
    },
    {
      "finding_id": "RPT-D0439AB081B43E6DCB96CE00",
      "finding_kind": "COMPONENT_ISSUE",
      "input_hash": "1b8f7684a42f33b5e4a4e2f255d9a8849d34f9c32834eb47df50f483dccf29fe",
      "message": "analysis evidence is not available",
      "package_version": "0.4.0",
      "reason_code": "STABILITY_EVIDENCE_MISSING",
      "rule_id": "REP02.REGULATOR.LOOP_STABILITY.EVIDENCE",
      "source_refs": [
        {
          "sha256": "92ab4059050fb5d381fa4b7c7cbf2301212c6956be0255d39f8da15ccb85187b",
          "source_id": "REP02-RR-RULES",
          "version": "REP02-RR-RULESET-1.0.0"
        }
      ],
      "status": "BLOCKED",
      "technical_locator": "$.issues[3]",
      "technical_result_hash": "c6bdea93c3d7f26b07a16cc631f0d859c9139b4e1bb1a87c42bc472c0cabc900",
      "tool_name": "power-rail-validation",
      "tool_version": "0.1.0"
    },
    {
      "finding_id": "RPT-85ECE69B09AC71AB8EAE1D2A",
      "finding_kind": "COMPONENT_ISSUE",
      "input_hash": "1b8f7684a42f33b5e4a4e2f255d9a8849d34f9c32834eb47df50f483dccf29fe",
      "message": "model applicability cannot be decided before provenance passes",
      "package_version": "0.4.0",
      "reason_code": "MODEL_PROVENANCE_BLOCKED",
      "rule_id": "REP02.REGULATOR.MODEL.APPLICABILITY",
      "source_refs": [
        {
          "sha256": "92ab4059050fb5d381fa4b7c7cbf2301212c6956be0255d39f8da15ccb85187b",
          "source_id": "REP02-RR-RULES",
          "version": "REP02-RR-RULESET-1.0.0"
        }
      ],
      "status": "BLOCKED",
      "technical_locator": "$.issues[4]",